{
  "arn": "arn:aws:proton:us-east-1:123456789:environment/my-env",
  "createdAt": "example-createdAt",
  "description": "example-description",
  "lastModifiedAt": "example-lastModifiedAt",
  "name": "my-environment",
  "status": "ACTIVE",
  "statusMessage": "ACTIVE",
  "templateName": "my-environment"
}